[
  {
    "query_id": "QP-011",
    "query": "For each sales representative, show their total closed deals and average deal size for the past 12 months, joined with their assigned region and manager name.",
    "intent": "Execute a multi-table SQL join across sales, employee, and region tables",
    "domain": "finance_and_sales",
    "knowledge_type": "private_factual",
    "required_data_sources": [
      "enterprise_sales_database",
      "enterprise_hr_system"
    ],
    "required_capabilities": [
      "sql",
      "structured_data_query",
      "multi_source_join"
    ],
    "complexity": "high",
    "risk": "LOW_RISK",
    "actionability": "informational",
    "sensitivity": "POTENTIAL_PII",
    "ambiguity": "low",
    "expected_route": "sql_query",
    "taxonomy_labels": [
      "SQL",
      "ANALYTICAL",
      "MULTI_SOURCE"
    ],
    "provenance": "SYNTHETIC",
    "generation_date": "2026-08-26",
    "prompt_version": "v0.1",
    "validation_method": "manual_review"
  },
  {
    "query_id": "QP-268",
    "query": "Combine our Q3 regional revenue metrics with published macroeconomic GDP forecasts and currency fluctuation rates to generate risk-adjusted Q4 revenue forecasts.",
    "intent": "Multi-source macroeconomic and internal financial forecasting",
    "domain": "finance_and_operations",
    "knowledge_type": "mixed",
    "required_data_sources": [
      "enterprise_crm_system",
      "enterprise_sales_database",
      "internal_strategy_documents",
      "public_knowledge"
    ],
    "required_capabilities": [
      "retrieval",
      "analytical_reasoning",
      "reasoning",
      "multi_source_join",
      "decision_support"
    ],
    "complexity": "high",
    "risk": "MEDIUM_RISK",
    "actionability": "decisional",
    "sensitivity": "SENSITIVE_DATA_EXPOSURE",
    "ambiguity": "medium",
    "expected_route": "multi_step_orchestration",
    "taxonomy_labels": [
      "MULTI_SOURCE",
      "MULTI_STEP",
      "ANALYTICAL",
      "DECISION_SUPPORT"
    ],
    "provenance": "SYNTHETIC",
    "generation_date": "2026-08-26",
    "prompt_version": "v0.1",
    "validation_method": "manual_review"
  },
  {
    "query_id": "QP-123",
    "query": "How many orders with a value exceeding $10,000 experienced shipping delays greater than 3 days last quarter?",
    "intent": "Count delayed high-value orders",
    "domain": "operations",
    "knowledge_type": "private_factual",
    "required_data_sources": [
      "enterprise_sales_database"
    ],
    "required_capabilities": [
      "sql",
      "structured_data_query"
    ],
    "complexity": "medium",
    "risk": "LOW_RISK",
    "actionability": "informational",
    "sensitivity": "NONE",
    "ambiguity": "low",
    "expected_route": "sql_query",
    "taxonomy_labels": [
      "SQL",
      "ANALYTICAL"
    ],
    "provenance": "SYNTHETIC",
    "generation_date": "2026-08-26",
    "prompt_version": "v0.1",
    "validation_method": "manual_review"
  },
  {
    "query_id": "QP-020",
    "query": "We have a $2M discretionary budget for H2. Given current pipeline coverage, team capacity, and the strategic priorities set in last month board meeting, how should we allocate it across Sales, Marketing, and Engineering?",
    "intent": "Support a high-stakes budget allocation decision using multiple internal data inputs",
    "domain": "executive_strategy",
    "knowledge_type": "private_factual",
    "required_data_sources": [
      "internal_strategy_documents",
      "enterprise_sales_database",
      "enterprise_hr_system"
    ],
    "required_capabilities": [
      "analytical_reasoning",
      "decision_support",
      "recommendation"
    ],
    "complexity": "high",
    "risk": "HIGH_RISK",
    "actionability": "decisional",
    "sensitivity": "SENSITIVE_DATA_EXPOSURE",
    "ambiguity": "medium",
    "expected_route": "decision_support",
    "taxonomy_labels": [
      "DECISION_SUPPORT",
      "ANALYTICAL",
      "RECOMMENDATION"
    ],
    "provenance": "SYNTHETIC",
    "generation_date": "2026-08-26",
    "prompt_version": "v0.1",
    "validation_method": "manual_review"
  },
  {
    "query_id": "QP-046",
    "query": "What organization maintains the RFC standards for the Internet?",
    "intent": "Standards body lookup",
    "domain": "information_technology",
    "knowledge_type": "public_factual",
    "required_data_sources": [
      "public_knowledge"
    ],
    "required_capabilities": [
      "factual_retrieval"
    ],
    "complexity": "low",
    "risk": "NO_ACTION",
    "actionability": "informational",
    "sensitivity": "NONE",
    "ambiguity": "low",
    "expected_route": "public_knowledge_retrieval",
    "taxonomy_labels": [
      "PUBLIC_FACTUAL"
    ],
    "provenance": "DERIVED",
    "generation_date": "2026-08-26",
    "prompt_version": "v0.1",
    "validation_method": "manual_review",
    "source_dataset": "MMLU",
    "source_license": "MIT"
  },
  {
    "query_id": "QP-157",
    "query": "Analyze the correlation between our customer onboarding time (in days) and net revenue retention at month 12 across enterprise cohorts.",
    "intent": "Analyze onboarding duration vs NRR correlation",
    "domain": "business_analytics",
    "knowledge_type": "mixed",
    "required_data_sources": [
      "public_knowledge",
      "enterprise_sales_database"
    ],
    "required_capabilities": [
      "reasoning",
      "analytical_reasoning"
    ],
    "complexity": "high",
    "risk": "LOW_RISK",
    "actionability": "analytical",
    "sensitivity": "NONE",
    "ambiguity": "low",
    "expected_route": "analytical_reasoning",
    "taxonomy_labels": [
      "ANALYTICAL",
      "MULTI_SOURCE"
    ],
    "provenance": "SYNTHETIC",
    "generation_date": "2026-08-26",
    "prompt_version": "v0.1",
    "validation_method": "manual_review"
  },
  {
    "query_id": "QP-066",
    "query": "What is the current firmware version deployed on the core office routers?",
    "intent": "Lookup network equipment version",
    "domain": "information_technology",
    "knowledge_type": "private_factual",
    "required_data_sources": [
      "enterprise_network_system"
    ],
    "required_capabilities": [
      "enterprise_data_retrieval"
    ],
    "complexity": "low",
    "risk": "LOW_RISK",
    "actionability": "informational",
    "sensitivity": "NONE",
    "ambiguity": "low",
    "expected_route": "enterprise_data_retrieval",
    "taxonomy_labels": [
      "PRIVATE_FACTUAL"
    ],
    "provenance": "SYNTHETIC",
    "generation_date": "2026-08-26",
    "prompt_version": "v0.1",
    "validation_method": "manual_review"
  },
  {
    "query_id": "QP-163",
    "query": "Write a thread-safe singleton class in Python with double-checked locking.",
    "intent": "Implement thread-safe singleton pattern in Python",
    "domain": "software_engineering",
    "knowledge_type": "public_factual",
    "required_data_sources": [
      "public_knowledge"
    ],
    "required_capabilities": [
      "code_generation"
    ],
    "complexity": "medium",
    "risk": "NO_ACTION",
    "actionability": "generative",
    "sensitivity": "NONE",
    "ambiguity": "low",
    "expected_route": "code_generation",
    "taxonomy_labels": [
      "CODING"
    ],
    "provenance": "SYNTHETIC",
    "generation_date": "2026-08-26",
    "prompt_version": "v0.1",
    "validation_method": "manual_review"
  },
  {
    "query_id": "QP-171",
    "query": "Write a Dockerfile for a Python FastAPI application optimizing for multi-stage builds and minimal image layer caching.",
    "intent": "Write multi-stage Dockerfile for FastAPI",
    "domain": "software_engineering",
    "knowledge_type": "public_factual",
    "required_data_sources": [
      "public_knowledge"
    ],
    "required_capabilities": [
      "code_generation"
    ],
    "complexity": "medium",
    "risk": "NO_ACTION",
    "actionability": "generative",
    "sensitivity": "NONE",
    "ambiguity": "low",
    "expected_route": "code_generation",
    "taxonomy_labels": [
      "CODING"
    ],
    "provenance": "SYNTHETIC",
    "generation_date": "2026-08-26",
    "prompt_version": "v0.1",
    "validation_method": "manual_review"
  },
  {
    "query_id": "QP-176",
    "query": "Implement an LRU cache in Java using LinkedHashMap with a maximum capacity eviction policy.",
    "intent": "Implement LRU cache in Java",
    "domain": "software_engineering",
    "knowledge_type": "public_factual",
    "required_data_sources": [
      "public_knowledge"
    ],
    "required_capabilities": [
      "code_generation"
    ],
    "complexity": "medium",
    "risk": "NO_ACTION",
    "actionability": "generative",
    "sensitivity": "NONE",
    "ambiguity": "low",
    "expected_route": "code_generation",
    "taxonomy_labels": [
      "CODING"
    ],
    "provenance": "SYNTHETIC",
    "generation_date": "2026-08-26",
    "prompt_version": "v0.1",
    "validation_method": "manual_review"
  },
  {
    "query_id": "QP-010",
    "query": "What were the total net sales by product category for Q3 of the current fiscal year?",
    "intent": "Aggregate structured financial data from the enterprise sales database",
    "domain": "finance_and_sales",
    "knowledge_type": "private_factual",
    "required_data_sources": [
      "enterprise_sales_database"
    ],
    "required_capabilities": [
      "sql",
      "structured_data_query"
    ],
    "complexity": "medium",
    "risk": "LOW_RISK",
    "actionability": "informational",
    "sensitivity": "NONE",
    "ambiguity": "low",
    "expected_route": "sql_query",
    "taxonomy_labels": [
      "SQL",
      "ANALYTICAL"
    ],
    "provenance": "SYNTHETIC",
    "generation_date": "2026-08-26",
    "prompt_version": "v0.1",
    "validation_method": "manual_review"
  },
  {
    "query_id": "QP-003",
    "query": "What are the data residency requirements under the EU AI Act for high-risk AI systems processing personal data?",
    "intent": "Look up public regulatory requirements for AI system compliance",